name,ring,quadrant,isNew,description
Kotlin,Adopt,Languages & Frameworks,FALSE,Modern statically-typed programming language for JVM, Android, and more,
Recycli,Adopt,Languages & Frameworks,FALSE,Kotlin library for Android RecyclerView that simplifies the creation of multiple view types lists. Featuring DiffUtils inside, annotation-based adapter generator and MVI pattern as philosophy, it is both a simple and powerful tool for rapid development of RecyclerView-based screens,
RxKotlin,Hold,Languages & Frameworks,FALSE,Reactive extension for Kotlin, functional reactive programming,
Kotlin Coroutines,Adopt,Languages & Frameworks,TRUE,Lightweight, non-blocking concurrency for Kotlin, simplifies async code,
Gson,Adopt,Languages & Frameworks,FALSE,JSON parsing library for Java, serialization/deserialization,
Retrofit,Adopt,Languages & Frameworks,FALSE,Type-safe HTTP client for Android and Java, RESTful web services,
Hilt,Adopt,Languages & Frameworks,FALSE,Dependency injection library built on top of Dagger, simplifies DI,
Jetpack Navigation,Adopt,Languages & Frameworks,FALSE,Android Navigation component, simplifies navigation between screens,
Flow,Adopt,Languages & Frameworks,TRUE,Reactive streams in Kotlin, async data streams,
LiveData,Hold,Languages & Frameworks,FALSE,Observable data holder for Android, lifecycle-aware,
Room,Adopt,Languages & Frameworks,FALSE,SQLite abstraction library, simplifies local data storage,
Picasso,Adopt,Languages & Frameworks,FALSE,Image downloading and caching library for Android,
Jetpack Architecture Components,Adopt,Languages & Frameworks,FALSE,Collection of libraries to design robust, testable, maintainable apps,
Lint,Adopt,Tools,FALSE,Static code analysis tool for Android, finds code issues,
Gradle,Adopt,Tools,FALSE,Build automation system, dependency management, build scripts,
Gitlab,Adopt,Platforms,FALSE,Web-based DevOps platform, repository management, CI/CD, monitoring,
Firebase,Adopt,Platforms,FALSE,Backend-as-a-Service platform, real-time database, authentication, storage,
Android studio,Adopt,Tools,FALSE,Official Android IDE, development tools, debugging, testing,
Jira,Adopt,Platforms,FALSE,Project management tool, issue tracking, agile development,
Jetpack Compose,Trial,Languages & Frameworks,TRUE,Declarative UI toolkit for Android, simplifies UI development,
Feature Flags,Adopt,Techniques,FALSE,Toggle features on/off at runtime, supports experimentation, A/B testing,
Snow Plow,Trial,Languages & Frameworks,TRUE,Real-time event data pipeline, analytics, data collection,
Firebase,Adopt,Platforms,FALSE,Duplicate entry, refer to the first Firebase entry for description,
Confluence,Adopt,Platforms,FALSE,Team collaboration software, documentation, knowledge sharing,
Kaspresso,Adopt,Languages & Frameworks,FALSE,UI testing library for Android, built on Espresso, simplifies testing,
Wiremock,Adopt,Tools,FALSE,HTTP mocking library, API stubs, simulates web service behavior,
UI tests,Adopt,Techniques,FALSE,Testing approach, focuses on UI interactions, validates user experience,
JUnit4,Adopt,Languages & Frameworks,FALSE,Unit testing framework for Java, test organization, execution, results,
Ktor,Adopt,Languages & Frameworks,FALSE,Kotlin asynchronous web framework, server and client apps,
Yandex Maps,Adopt,Languages & Frameworks,FALSE,Mapping library, location services, geocoding, routing,
Google ML-kit,Adopt,Languages & Frameworks,FALSE,Machine learning SDK, on-device
